{
  "schema_version": 2,
  "structs": {
    "OpaquePayload9": [
      {"name": "note", "type": "Option<String>"},
      {"name": "attempts", "type": "i64"},
      {"name": "title", "type": "String"},
      {"name": "ready", "type": "bool"}
    ]
  },
  "enums": {},
  "aliases": {},
  "operations": {
    "call_result_31": {
      "name": "unrelated_snapshot_method",
      "parameters": [],
      "return_type": "Result<OpaquePayload9, Error>",
      "success_type": "OpaquePayload9"
    }
  },
  "symbol_paths": {
    "OpaquePayload9": "crate::generated::types::OpaquePayload9"
  },
  "binding": {
    "client": {
      "type_path": "crate::generated::client::HttpClient",
      "constructor": "new",
      "api_key_builder": "with_api_key",
      "base_url_builder": "with_base_url"
    },
    "type_preludes": ["crate::generated::types::*"]
  }
}
