{
  "schema_version": 2,
  "structs": {
    "OpaqueProfile9": [
      {"name": "settings", "type": "OpaqueSettings4"},
      {"name": "name", "type": "String"}
    ],
    "OpaqueSettings4": [
      {"name": "tuning", "type": "Option<Option<OpaqueTuning2>>"},
      {"name": "mode", "type": "String"}
    ],
    "OpaqueTuning2": [
      {"name": "threshold", "type": "Option<i64>"}
    ]
  },
  "enums": {},
  "aliases": {},
  "operations": {
    "opaque_profile_call": {
      "name": "unrelated_profile_method",
      "parameters": [
        {"name": "validate", "type": "Option<bool>"},
        {"name": "payload", "type": "OpaqueProfile9"},
        {"name": "account_id", "type": "impl AsRef<str>"}
      ],
      "return_type": "Result<(), Error>",
      "success_type": "()"
    }
  },
  "symbol_paths": {
    "OpaqueProfile9": "crate::generated::types::OpaqueProfile9",
    "OpaqueSettings4": "crate::generated::types::OpaqueSettings4",
    "OpaqueTuning2": "crate::generated::types::OpaqueTuning2"
  },
  "binding": {
    "client": {
      "type_path": "crate::generated::client::HttpClient",
      "constructor": "new",
      "api_key_builder": "with_api_key",
      "base_url_builder": "with_base_url"
    },
    "type_preludes": ["crate::generated::types::*"]
  }
}
