{
  "schema_version": 2,
  "structs": {
    "UpdateJobRequest": [
      {"name": "priority", "type": "Option<i64>"},
      {"name": "title", "type": "String"}
    ]
  },
  "enums": {},
  "aliases": {},
  "operations": {
    "call_42": {
      "name": "call_42",
      "parameters": [
        {"name": "dry_run", "type": "Option<bool>"},
        {"name": "request", "type": "UpdateJobRequest"},
        {"name": "job_id", "type": "impl AsRef<str>"},
        {"name": "workspace_id", "type": "impl AsRef<str>"}
      ],
      "return_type": "Result<(), Error>",
      "success_type": "()"
    }
  },
  "symbol_paths": {
    "UpdateJobRequest": "crate::generated::types::UpdateJobRequest"
  },
  "binding": {
    "client": {
      "type_path": "crate::generated::client::HttpClient",
      "constructor": "new",
      "api_key_builder": "with_api_key",
      "base_url_builder": "with_base_url"
    },
    "type_preludes": ["crate::generated::types::*"]
  }
}
